{
  "version": "1",
  "projectId": "carddemo",
  "source": {
    "language": "cobol",
    "roots": [
      "src/mainframe",
      "copybooks"
    ],
    "include": [
      "**/*.cbl",
      "**/*.cob",
      "**/*.cpy",
      "**/*.jcl"
    ],
    "exclude": [
      "**/target/**",
      "**/.git/**"
    ]
  },
  "targets": [
    {
      "language": "java",
      "root": "generated/java",
      "package": "com.example.modernized",
      "framework": "spring"
    }
  ],
  "artifacts": {
    "domainModel": ".renovatio/diagrams/carddemo.renovatio-domain.json",
    "persistenceModel": ".renovatio/diagrams/carddemo-persistence.renovatio-domain.json",
    "architecture": ".renovatio/diagrams/carddemo.renovatio-arch.json",
    "migrationMap": ".renovatio/migration-map.renovatio.json",
    "evidenceDir": ".renovatio/evidence"
  },
  "backend": {
    "url": "http://127.0.0.1:8081",
    "environment": "local",
    "healthEndpoint": "/actuator/health",
    "capabilitiesEndpoint": "/api/capabilities",
    "allowLocalProcessControl": true,
    "commands": {
      "start": "./mvnw -pl renovatio-api spring-boot:run",
      "stop": "renovatio backend stop",
      "restart": "renovatio backend restart",
      "reloadConfig": "curl -X POST http://127.0.0.1:8081/api/admin/reload"
    }
  },
  "llm": {
    "provider": "ollama",
    "model": "codellama:13b",
    "purpose": "cobol-reverse-engineering",
    "temperature": 0.1,
    "maxTokens": 8192,
    "cacheEnabled": true,
    "promptProfile": "cobol.domain.entities.v1",
    "fallbackModel": null
  }
}
